{
  "schema_version": 1,
  "generator": "tools/qualityinvariants",
  "modules": [
    "identity",
    "profiles",
    "wallet",
    "entitlements",
    "arenas",
    "positions",
    "arguments",
    "persuasion",
    "billing",
    "moderation",
    "transparency",
    "jobs"
  ],
  "invariants": [
    {
      "id": "INV-REQ-ARG-01",
      "module": "arguments",
      "packages": [
        "internal/arguments"
      ],
      "risk": "Q1",
      "transition": "holds in published: Publicação de argumento associado a uma arena com declaração explícita de relação com a afirmação (a favor, contra, contextual).",
      "precondition": "Só a conta elegível publica na própria identidade.",
      "postcondition": "A chave de idempotência impede a segunda publicação do mesmo envio.",
      "global_invariant": "A publicação grava o argumento numa transação sob a chave de idempotência. Segurança: A relação é validada contra o vocabulário canônico antes de gravar.",
      "prohibited_effect": "Proibido violar: A relação é validada contra o vocabulário canônico antes de gravar. Privacidade: O argumento é público por desenho e carrega apenas o texto e as fontes.",
      "catalog": "QUAL-REQ-ARG-01",
      "persisted": false,
      "unreachable": false,
      "tests": {
        "valid": "internal/arguments/application/publish_argument_test.go::TestPublishArgumentRecordsAtomically",
        "invalid": "internal/arguments/domain/relation_test.go::TestParseRelationAcceptsOnlyCanonicalVocabulary",
        "limit": "",
        "replay": ""
      }
    },
    {
      "id": "INV-REQ-ARG-02",
      "module": "arguments",
      "packages": [
        "internal/arguments"
      ],
      "risk": "Q1",
      "transition": "holds in published: Publicação de respostas diretamente a outro argumento da mesma arena em estrutura lógica encadeada de 1 nível recursivo.",
      "precondition": "A resposta é publicada pela conta titular, referenciando o argumento pai.",
      "postcondition": "A resposta carrega o próprio identificador de idempotência.",
      "global_invariant": "A profundidade é decidida na transação, lendo o pai da mesma arena. Segurança: A recursão é limitada a um nível pelo domínio e pelo schema.",
      "prohibited_effect": "Proibido violar: A recursão é limitada a um nível pelo domínio e pelo schema. Privacidade: A resposta é pública e não acrescenta dado de terceiro.",
      "catalog": "QUAL-REQ-ARG-02",
      "persisted": false,
      "unreachable": false,
      "tests": {
        "valid": "internal/arguments/application/publish_argument_test.go::TestPublishArgumentRepliesCarryTheirParent",
        "invalid": "internal/arguments/application/publish_argument_test.go::TestPublishArgumentRejectsDeepReplies",
        "limit": "internal/arguments/domain/reply_policy_test.go::TestReplyPolicyAcceptsOneRecursionLevel",
        "replay": ""
      }
    },
    {
      "id": "INV-REQ-ARG-03",
      "module": "arguments",
      "packages": [
        "internal/arguments"
      ],
      "risk": "Q1",
      "transition": "holds in published: Adição de fontes estruturadas por URL válida e descrição curta, associadas ao argumento sem custo de INK, com validação de esquema de protoc",
      "precondition": "As fontes são do autor do argumento e não têm custo de INK.",
      "postcondition": "A mesma URL é canonicalizada para a mesma fonte.",
      "global_invariant": "As fontes entram na mesma transação da publicação do argumento. Segurança: O esquema de protocolo é validado e canonicalizado no domínio.",
      "prohibited_effect": "Proibido violar: O esquema de protocolo é validado e canonicalizado no domínio. Privacidade: A fonte é pública por desenho e não carrega dado de terceiro.",
      "catalog": "QUAL-REQ-ARG-03",
      "persisted": false,
      "unreachable": false,
      "tests": {
        "valid": "internal/arguments/domain/source_test.go::TestParseSourceCanonicalizesAndValidates",
        "invalid": "internal/arguments/domain/source_test.go::TestReconstituteSourceValidatesStoredState",
        "limit": "",
        "replay": ""
      }
    },
    {
      "id": "INV-REQ-ARG-04",
      "module": "arguments",
      "packages": [
        "internal/arguments"
      ],
      "risk": "Q1",
      "transition": "holds in published: Limite estrito de no máximo 3.000 grapheme clusters de texto por argumento, computados com biblioteca precisa de segmentação Unicode.",
      "precondition": "O conteúdo é do autor e medido antes de qualquer débito.",
      "postcondition": "O mesmo texto normalizado mede sempre o mesmo.",
      "global_invariant": "A medição é pura sobre o texto, sem estado compartilhado. Segurança: A contagem é de grapheme clusters, com biblioteca precisa de segmentação Unicode.",
      "prohibited_effect": "Proibido violar: A contagem é de grapheme clusters, com biblioteca precisa de segmentação Unicode. Privacidade: O conteúdo é público por desenho e não carrega dado de terceiro.",
      "catalog": "QUAL-REQ-ARG-04",
      "persisted": false,
      "unreachable": false,
      "tests": {
        "valid": "internal/arguments/domain/content_test.go::TestParseContentNormalizesAndMeasures",
        "invalid": "internal/arguments/domain/content_test.go::TestParseContentRejections",
        "limit": "internal/arguments/domain/content_test.go::TestParseContentRejections",
        "replay": ""
      }
    },
    {
      "id": "INV-REQ-ARG-05",
      "module": "arguments",
      "packages": [
        "internal/arguments",
        "internal/wallet"
      ],
      "risk": "Q1",
      "transition": "previewed -> published: Interface de prévia obrigatória e exibição do cálculo exato de custo em INK antes da confirmação de publicação pelo participante.",
      "precondition": "A prévia é do próprio titular, que vê o saldo e o custo antes de confirmar.",
      "postcondition": "Repetir a prévia mostra o mesmo custo para o mesmo conteúdo.",
      "global_invariant": "O saldo lido para a prévia é uma leitura, sem reservar INK. Segurança: O custo é calculado no servidor a partir do texto medido, nunca informado pelo cliente.",
      "prohibited_effect": "Proibido violar: O custo é calculado no servidor a partir do texto medido, nunca informado pelo cliente. Privacidade: A prévia mostra apenas o saldo e o custo do próprio titular.",
      "catalog": "QUAL-REQ-ARG-05",
      "persisted": false,
      "unreachable": false,
      "tests": {
        "valid": "internal/wallet/application/queries_test.go::TestGetWalletBalanceUseCase",
        "invalid": "internal/wallet/domain/allocation_test.go::TestAllocateDebitPriority",
        "limit": "",
        "replay": ""
      }
    },
    {
      "id": "INV-REQ-ARG-06",
      "module": "arguments",
      "packages": [
        "internal/arguments"
      ],
      "risk": "Q1",
      "transition": "published -> withdrawn: Retirada voluntária de argumento da exibição pública pelo autor, mantendo o registro histórico e auditável sem estorno automático de INK.",
      "precondition": "Só o autor retira o próprio argumento, e a retirada é owner-scoped.",
      "postcondition": "Retirar de novo o mesmo argumento não muda o estado nem o histórico.",
      "global_invariant": "A retirada é decidida contra o estado gravado e não estorna INK. Segurança: A retirada muda a exibição e mantém o registro histórico auditável.",
      "prohibited_effect": "Proibido violar: A retirada muda a exibição e mantém o registro histórico auditável. Privacidade: A retirada não apaga o texto nem as atribuições já registradas.",
      "catalog": "QUAL-REQ-ARG-06",
      "persisted": false,
      "unreachable": false,
      "tests": {
        "valid": "internal/arguments/application/withdraw_argument_test.go::TestWithdrawArgumentRetractsForTheAuthor",
        "invalid": "internal/arguments/application/withdraw_argument_test.go::TestWithdrawArgumentIsOwnerScoped",
        "limit": "internal/arguments/application/withdraw_argument_test.go::TestWithdrawArgumentValidatesInputsWithoutWriting",
        "replay": ""
      }
    },
    {
      "id": "INV-REQ-ARG-07",
      "module": "arguments",
      "packages": [
        "internal/arguments"
      ],
      "risk": "Q1",
      "transition": "published -> moderated: Imutabilidade do conteúdo publicado: argumentos e respostas não sofrem edição silenciosa no MVP.",
      "precondition": "Ninguém edita o conteúdo: nem o autor, nem a moderação, que muda a exibição e não o texto.",
      "postcondition": "O hash do conteúdo é estável entre execuções, o que prova a imutabilidade.",
      "global_invariant": "A escrita do conteúdo acontece uma vez, na publicação. Segurança: Não existe rota de edição, e o contrato é comparado com as rotas registradas.",
      "prohibited_effect": "Proibido violar: Não existe rota de edição, e o contrato é comparado com as rotas registradas. Privacidade: O conteúdo é do autor e a moderação preserva o registro histórico.",
      "catalog": "QUAL-REQ-ARG-07",
      "persisted": false,
      "unreachable": false,
      "tests": {
        "valid": "internal/platform/postgres/argument_schema_test.go::TestArgumentImmutabilityAndRetention",
        "invalid": "internal/arguments/adapters/postgres/repository_test.go::TestPublishArgumentRejectsInvalidParents",
        "limit": "",
        "replay": ""
      }
    },
    {
      "id": "INV-REQ-ARG-08",
      "module": "arguments",
      "packages": [
        "internal/arguments"
      ],
      "risk": "Q1",
      "transition": "holds in published: Ordenação padrão de listas de argumentos por data (recente/antiga); exibição de contagem de persuasão sem tornar-se o ranking padrão obrigat",
      "precondition": "A leitura é pública e não exige conta.",
      "postcondition": "O mesmo cursor devolve a mesma página, com empates resolvidos pelo desempate estável.",